Title,Organization,Course_duration,Course_clases,Course_level,Course_actual_price,Course_original_price
"Canva para Principiantes
Aprende a usar una herramienta de diseño web",María Fe K.,"3,5 horas en total",80 ,Todos los niveles,"14,99 €","19,99 €"
"Adobe Animate Animación 2d+Interactividad Android/iOS, HTML5
Aprende Animación 2d e interactividad y Videojuegos en Adobe Animate, revisa los videos gratis (editables incluidos)",Ruth Cepero,2 horas en total,18 ,Todos los niveles,"14,99 €","94,99 €"
"Como encontrar imágenes gratuitas para diseños digitales
Encontraras elementos suficientes para crear infinidad de diseños con ilustraciones diferentes para tus redes sociales.",Marlon Ceballos,"11,5 horas en total",47 ,Intermedio,"14,99 €","19,99 €"
"Curso de SOLIDWORKS 2022 para principiantes hasta avanzado
Aprende a crear piezas, dibujos, planos, ensamblajes y todo lo que tu imaginación requiera con este Curso de SOLIDWORKS","Miguel Angel Soto, SDQ Training Center","6,5 horas en total",23 ,Todos los niveles,"14,99 €","94,99 €"
"Animación CGI 3D con UNITY
Producciones para Principiantes con Unity","Joel Combes, SDQ Training Center",8 horas en total,16 ,Todos los niveles,"14,99 €","19,99 €"
"QGIS Planes, Mapas y Estudios Urbanísticos. Software Libre
Curso Completo Sistema de Información Geográfica de Software Libre y de Código Abierto",Daniel Nuñez,"9,5 horas en total",29 ,Intermedio,"14,99 €","49,99 €"
"Dibuja como un Arquitecto: de la perspectiva a los detalles
Aprende a dibujar como un arquitecto, desde cero y en menos de una hora.",Alfredo Gutierrez Garcia,4 horas en total,7 ,Principiante,"14,99 €","94,99 €"
"Curso de Dibujo: Retrato
principios básicos del dibujo del rostro",Moises Baxin,6 horas en total,10 ,Todos los niveles,"14,99 €","94,99 €"
"AutoCAD con Cyana Ingeniería
Enfocado en el aumento de la productividad y corrección de errores","Álvaro García, Formación Certificada, Cursos Online Arquitectura",1 hora en total,11 ,Intermedio,"14,99 €","94,99 €"
"Curso Diseño y Decoración para bodas y eventos
Aprende a decorar y diseñar bodas, fiestas y eventos generando ingresos aunque no tengas experiencia","Álvaro García, Formación Certificada, Cursos Online Arquitectura",5 horas en total,48 ,Intermedio,"14,99 €","94,99 €"
"Diseño de Caricaturas desde Cero
Aprende como dibujar caricaturas como las que ves en tv, !desde cero!.",Leopoldo Juárez Ramírez,"10,5 horas en total",59 ,Intermedio,"14,99 €","94,99 €"
"Moda y Costura + Reciclaje de Prendas
Comienza a reciclar prendas y crear objetos textiles desde una mirada sustentable. Aprende costura a mano y con máquina.",José Alejandro Zubieta,5 horas en total,33 ,Todos los niveles,"24,99 €",
"Aerografía desde Cero
Introduciéndose al apasionante mundo de la aerografía.",Raul Martinez,18 horas en total,91 ,Todos los niveles,"14,99 €","19,99 €"
"Introducción a la Sastrería: diseño de chaqueta estructurada
El curso mas completo con enfoque en sastrería en donde aprenderás paso a paso como hacer una chaqueta smoking",Sebastián Burgio,9 horas en total,29 ,Principiante,"14,99 €","19,99 €"
"Galapagos y Biomorpher en Grasshopper: Al Bahr como ejemplo
Ejercicio guiado para prototipado rápido de una de las fachadas tipo Al Bahr",Rubén Alvarez,"1,5 horas en total",29 ,Principiante,"14,99 €","19,99 €"
"Certificación VRay para 3dsMax
Curso de preparación para certificación oficial",Luis Santos santos,"6,5 horas en total",23 ,Intermedio,"14,99 €","29,99 €"
"Introducción al análisis ambiental en Ladybug de Grasshopper
Gráficas climáticas interactivas, estudios de radiación, soleamiento y vientos, así como IA aplicada a la envolvente",Raul Martinez,6 horas en total,17 ,Todos los niveles,"14,99 €","24,99 €"
"Curso de Navisworks Manage 2021
Navisworks Manage revisa de manera integral los proyectos de construcción modelados con Revit y su metodología BIM.",Jonathan Arias,9 horas en total,55 ,Todos los niveles,"14,99 €","19,99 €"
"Diseña Estampados para imprimir en telas y productos.
Aprende a crear estampados que puedas monetizar e imprimir en tus telas y productos",Carlos Pech,"1,5 horas en total",18 ,Principiante,"14,99 €","94,99 €"
"Rig facial para animación en Maya
Aprende a crear un rig facial profesional para animacion - Vol. 2 del curso personajes infantiles para animación",KRIPER Artista Plástico,"3,5 horas en total",10 ,Todos los niveles,"14,99 €","94,99 €"
"Photoshop CS6
Uso y Manejo de Photoshop CS6",Katherine Vega,"2,5 horas en total",10 ,Principiante,"14,99 €","19,99 €"
"Solidworks Cam CamWorks
Generacion de codigo G mediante solidos, basado en estrategias",Francisco Bustos,30 minutos en total,8 ,Todos los niveles,"14,99 €","19,99 €"
"Curso de Impresión 3D, conviértete en un PRO
Modelado 3D, Componentes, teoría, software, solución de problemas, materiales, temas avanzados",Ruth Cepero,37 minutos en total,5 ,Principiante,"14,99 €","49,99 €"
"Como dibujar animales estilo cartoon
¡aprende a dibujar de manera sencilla a nuestros amigos de la naturaleza!",Marlon Ceballos,8 horas en total,43 ,Principiante,"14,99 €","44,99 €"
"Curso de Photoshop CC : Como crear PORTADAS para tus CDs
diseña tus covers para tus canciones con la mejor calidad usando photoshop","Miguel Angel Soto, SDQ Training Center","6,5 horas en total",26 ,Intermedio,"14,99 €","19,99 €"
"Curso de Revit 2022 para principiantes desde cero
Ingresa al mundo BIM con este Curso de Revit 2022. Comprende la creación de un proyecto de construcción completo.","Joel Combes, SDQ Training Center","4,5 horas en total",71 ,Principiante,"14,99 €","19,99 €"
"Eleva tu modelo 3D a un siguiente nivel, con Blender 2.93.
Si sabes modelar con subdivisiones es hora de optimizar y preparar tu modelo para texturizarlo, ampliando tu portfolio.",Daniel Nuñez,1 hora en total,10 ,Todos los niveles,"14,99 €","49,99 €"
"Dibujar anime personajes fantasía
Dibujo anime",Jean Pierre Delgado Gonzales,1 hora en total,20 ,Principiante,"14,99 €","94,99 €"
"Experto en Diseño y Fabricación de FoodTruck o Gastronetas
Conviértete en un Experto en el Diseño de Restaurantes Móviles mediante Vehículos para Cocinar y Servir",Rodolfo Boscan,"26,5 horas en total",66 ,Todos los niveles,"14,99 €","94,99 €"
"Experto en Diseño de Fachadas y Paramentos Exteriores
Conviértete en un Experto en el Diseño de todo tipo de Fachadas y Acabos Exteriores en Edificación",Leopoldo Juárez Ramírez,6 horas en total,10 ,Principiante,"14,99 €","94,99 €"
"CANVA para EMPRENDEDORES - De Principiante a EXPERTO
Conviértete en experto en diseño para tus propias piezas gráficas y diseños profesionales con Canva",Raul Martinez,"2,5 horas en total",14 ,Principiante,"14,99 €","94,99 €"
"Experto en Diseño y Ejecución de Escaleras
Conviértete en un Experto en el Diseño de Escaleras de cualquier tipología",Edgar Wolv,"20,5 horas en total",123 ,Experto,"14,99 €","94,99 €"
"Dibujo e ilustración digital en Clip Studio Paint
Una guía completa sobre el proceso a seguir durante la creación y trazo de una ilustración digital",Edgar Wolv,42 minutos en total,7 ,Principiante,"14,99 €","19,99 €"
"Curso 2021 Blender 2.93/3.0 desde Bronce a Diamante.
Todo lo que necesitas para usar de manera avanzada Blender, modelado, texturizado y técnicas profesionales.",Christian Olmedo Regalado Sarmiento,"28,5 horas en total",126 ,Todos los niveles,"14,99 €","19,99 €"
"Decluttering. Organización de Espacios y Ambientes Interior
Conviértete en un Experto en el Diseño de Interiores Ordenados, Organizados, Limpios y en Armonía",Juan David Barona,36 minutos en total,7 ,Todos los niveles,"14,99 €","19,99 €"
"Model Sheet: diseño de personajes
Aprende a representar tu personaje de forma profesional a través de un Model sheet para su posterior modelado en 3D.",Manuel García Pallarés,5 horas en total,28 ,Experto,"14,99 €","39,99 €"
"After Effects - Anima explainer vídeos con motion graphics
Aprende a dominar After Effects a través de la animación de un video promocional utilizando técnicas de motion graphics",Paulo Caroli,"7,5 horas en total",32 ,Principiante,"14,99 €","39,99 €"
"Curso de Revit Structure 2021
¿Te gustaría ser más productivo y desarrollar proyectos de estructuras con las herramientas de modelado de Revit?",Hector Ulises Gonzalez Ornelas,8 horas en total,69 ,Todos los niveles,"14,99 €","19,99 €"
"Introducción al 3D y Fotorealismo
con SKETCHUP Y LUMION 11","Julio Ce, Casta Tutors",1 hora en total,12 ,Principiante,"24,99 €",
"Autodesk Inventor Intermedio
Autodesk Inventor Intermedio",Valeria Digital,"4,5 horas en total",22 ,Todos los niveles,"14,99 €","94,99 €"
"Experto en Diseño y Ejecución de Bodegas
Conviértete en un Experto en el Diseño de Espacios destinados al Almacenamiento y Conservación de distintos Bienes",Karina Mejia,3 horas en total,17 ,Intermedio,"14,99 €","49,99 €"
"Experto Diseño de Viviendas Prefabricadas e Industrializadas
Conviértete en un Experto en el Diseño de Edificaciones y Construcciones Completas creadas en Fabricas",Clemente Tinajero Diaz,"2,5 horas en total",17 ,Todos los niveles,"14,99 €","19,99 €"
"Experto en Diseño de Viviendas Energéticamente Pasivas
Conviértete en un Experto en el Diseño de Edificaciones y Construcciones Passivhaus. Crea un Mundo Más Sostenible.",Juan David Barona,4 horas en total,36 ,Principiante,"14,99 €","19,99 €"
"Experto en Diseño y Construcción de Proyectos en Madera
Conoce las claves del diseño, ejecución y construcción en madera. Conviértete en un Profesional",Ruth Cepero,"2,5 horas en total",20 ,Principiante,"14,99 €","19,99 €"
"Experto en Diseño de Espacios y Ambientes para Mascotas
Conviértete en un Experto en el Diseño de Hogares y Espacios destinados a todo tipo de Mascotas: perros, gatos, pájaros",Marlon Ceballos,"6,5 horas en total",22 ,Principiante,"14,99 €","24,99 €"
"Curso CSWA Solidworks
Certificado CSWA","Miguel Angel Soto, SDQ Training Center","5,5 horas en total",23 ,Intermedio,"14,99 €","69,99 €"
