Title,Organization,Course_duration,Course_clases,Course_level,Course_actual_price,Course_original_price
"Automatización de datos en Excel con Power Query
Extrae, modifica, transforma y analiza datos en Excel con Tablas Dinámicas utilizando Power Query y Power Pivot",Ricardo Naya,1 hora en total,33 ,Principiante,"14,99 €","94,99 €"
"Inteligencia Emocional para la vida y el trabajo
Aprende a entender y gestionar efectivamente las emociones para ser exitoso en tus vínculos personales y profesionales",Ricardo Naya,"2,5 horas en total",26 ,Todos los niveles,"14,99 €","89,99 €"
"Sharepoint Designer 2013 en Español | WorkFlows
Aprende a usar la herramienta mas popular de Administracion y flujos nativos de SharePoint",Juan Carlos Alemán Morales,2 horas en total,18 ,Intermedio,"14,99 €","44,99 €"
"Excel, la Guía Rápida. Lo que todo novato debe saber.
Herramienta de productividad vital para la nueva década, toma la decisión de fortalecer tus competencias administrativas",Jairo Galeas,3 horas en total,30 ,Intermedio,"39,99 €","49,99 €"
"Domina Microsoft Word 2019: ""desde cero""
Domina la herramienta de procesamiento de textos más popular, Microsoft Word 2013, Word 2016, Word 2019 y office 365",Numpi Cursos,7 horas en total,44 ,Todos los niveles,"14,99 €","94,99 €"
"Crea Dashboards con Google Data Studio y Google Analytics
Crea fantásticos informes de Google Data Studio utilizando Google Analytics como fuente de datos.","Eduardo Aponte R., Finnse Academia",12 horas en total,72 ,Principiante,"14,99 €","49,99 €"
"Power BI, Inicia en el mundo de la Inteligencia de Negocios
Inteligencia de negocios y Power BI. Conectar fuentes, Transformar y Preparar datos, Modelar y Visualizar.",Carlos Ramos,"8,5 horas en total",49 ,Todos los niveles,"14,99 €","19,99 €"
"Domina Google Sheets Fácil y Rápido
Aprende a dominar Google Sheets fácil y rápido",Manuel Adelmo Oropeza,"4,5 horas en total",19 ,Intermedio,"14,99 €","19,99 €"
"Microsoft Excel - Curso nivel intermedio (2/2)
Aprenda a usar Excel - paso a paso",Grupo Inti Ingenieria,3 horas en total,30 ,Principiante,"14,99 €","19,99 €"
"Curso básico SAP completo desde cero para 100% principiantes
Inicia a enriquecer tu conocimiento sobre una de las herramientas más utilizadas a nivel mundial","Tawoc Educación, Gastón Galarza, Alvaro Chirou • 1.300.000+ Enrollments Worldwide","13,5 horas en total",153 ,Todos los niveles,"79,99 €","94,99 €"
"Universidad Excel - Básico, Intermedio y Avanzado!
Master en Excel más completo. Incluye Funciones, Tablas Dinámicas, Gráficos, Power Query , Macros y más a profundidad!",Sebastian Tunnell,6 horas en total,22 ,Todos los niveles,"79,99 €","94,99 €"
"Gestión Proyectos con Microsoft Project
Según los estándares sugeridos en el PMBOK",AulaGEO Academy,"15,5 horas en total",51 ,Todos los niveles,"79,99 €","94,99 €"
"Curso práctico de AutoCAD Civil 3D 2020 (de 0 a profesional)
Aprende desde cero a utilizar esta poderosa herramienta de diseño de infraestructuras.",Wilmer Cordoba,5 horas en total,36 ,Todos los niveles,"15,99 €","19,99 €"
"Presentaciones Multimedia de Alto Impacto con PowerPoint
Convierte tus presentaciones en momentos inolvidables",Mg. Luis Arturo Vargas M.,3 horas en total,18 ,Principiante,"14,99 €","19,99 €"
"Introducción a Data studio con Google Sheets y MySQL (BETA)
Crear dashboard (tableros de control) en datastudio desde cero. (El curso actualmente esta en proceso de actualización)",Edvin Nuñez,3 horas en total,39 ,Experto,"19,99 €",
"Master en Power BI DAX
Aprende todo sobre el lenguaje DAX y obtén las habilidades necesarias para tener éxito en el desarrollo de sus modelos",Guillermo Saez Yandiola (TailorSheet),7 horas en total,37 ,Principiante,"109,99 €",
"Excel VBA - Macros desde 0
Aprenderemos todo sobre Macros, VBA, programaremos en Excel, Ejemplos reales y prácticos",Cesar A. Siso L.,31 minutos en total,7 ,Principiante,"39,99 €","49,99 €"
"Introducción a Azure DevOps 2023 - Nivel Principiante
Guía introductoria y básica para empezar a utilizar Microsoft Azure DevOps. ¡Desde cero y para nivel principiante!","Federico Garay, Escuela Directa",2 horas en total,14 ,Principiante,"15,99 €","19,99 €"
"EXCEL COMPLETO - PARA PRINCIPIANTES
Excel para negocios y empresas en crecimiento",Alfonso Rinsche,2 horas en total,36 ,Intermedio,"14,99 €","34,99 €"
"Trucos y Atajos de Excel - [2023]
Tu flujo de trabajo volará con TODOS los Atajos y Trucos para ser un NINJA de Microsoft Excel. Incluye Manual en PDF",Alfonso Rinsche,"8,5 horas en total",105 ,Todos los niveles,"14,99 €","94,99 €"
"Domina las Herramientas de Google para Trabajar en Equipo
Eleva tu productividad al máximo trabajando en equipo con las Herramientas de Google y de manera práctica",Etraining S.A DE C.V,12 horas en total,68 ,Todos los niveles,"14,99 €","49,99 €"
"Excel para Gestión de Información de Recursos Humanos
Mejorando el manejo de la información de RRHH",Ricardo Naya,"28,5 horas en total",340 ,Todos los niveles,"14,99 €","94,99 €"
"Curso SAP + Introducción SAP MM + ABAP + Exámenes y pruebas
Curso completo de SAP + Introducción SAP MM + ABAP + Certificaciones Exámenes test pruebas",Ricardo Naya,"2,5 horas en total",25 ,Todos los niveles,"14,99 €","89,99 €"
"CURSO DE ZOOM COMPLETO
Aprende como realizar videoconferencias, dictar clases, y compartir de forma rápida y sencilla.",Winder Ezequiel Castro,1 hora en total,26 ,Todos los niveles,"14,99 €","24,99 €"
"Reuniones de Trabajo Productivas en Oficina y Teletrabajo
Del tiempo perdido, al equipo de trabajo de alto desempeño",David Asurmendi,"8,5 horas en total",36 ,Todos los niveles,"14,99 €","94,99 €"
"Redacción de Contenido - Trabaja desde Casa como Redactor
Teletrabaja Redacción de Contenido por Cuenta Propia desde cualquier lugar como Creador de contenido.",Carlos Abelenda,"10,5 horas en total",37 ,Todos los niveles,"14,99 €","19,99 €"
"Curso Excel - Dashboard - Power Query - Power Pivot -DAX
Curso de Excel para diseño de reportes, dashboards y scorecard de de alto nivel con análisis de datos.",Educapolis LMS,"2,5 horas en total",15 ,Intermedio,"14,99 €","19,99 €"
"Presentaciones de Alto Impacto en PowerPoint
Para una comunicación eficaz y profesional.",Mentes Brillantes,"7,5 horas en total",45 ,Principiante,"14,99 €","94,99 €"
"Curso básico de gestión documental y organización de archivo
Aprender a gestionar documentos de manera efectiva es una necesidad de toda empresa y persona.",Liliana Romero Llano,3 horas en total,42 ,Todos los niveles,"14,99 €","94,99 €"
"Infopath 2013 en Sharepoint
Aprende a realizar Formularios en listas de Sharepoint con Infopath en Español",José María Aguilar Bravo,"6,5 horas en total",45 ,Todos los niveles,"14,99 €","19,99 €"
"Herramientas para Trabajo Remoto Home Office Trabaja en Casa
Aprende las herramientas y tecnologías más habituales para el teletrabajo. Trabaja desde casa de forma remota.",Reinaldo Cruz F.,1 hora en total,9 ,Principiante,"14,99 €","19,99 €"
"Aprende a usar Word en solo 6 capítulos, más uno gratis
Videos cortos y directos para un aprendizaje efectivo",Cesar Herreros,12 horas en total,74 ,Todos los niveles,"14,99 €","24,99 €"
"Aprende todo sobre Looker Studio 2023 (Data Studio)
En este curso vas a aprender todo lo que se sobre Looker Studio, antes Data Studio.",Eduardo Mesa,"7,5 horas en total",96 ,Todos los niveles,"14,99 €","24,99 €"
"Curso de Excel Online Completo: De Básico a Profesional
Aprende TODO para Dominar Microsoft Excel desde Cero a Nivel Avanzado: Fórmulas, Tablas Dinámicas, Macros, VBA",Alejandro Cuéllar Gaxiola,"3,5 horas en total",18 ,Intermedio,"14,99 €","44,99 €"
"Curso Avanzado de Google Sheets + Apps Script
Crea tu Propio Sistema con Apps Script y GS",Eduardo Mesa,"10,5 horas en total",74 ,Todos los niveles,"14,99 €","49,99 €"
"Curso Integral Power BI (Power Query, DAX, Dashboards, etc.)
Aprende a desarrollar procesos ETL, DAX, modelado, visualización y análisis de datos, diseño de dashboards, entre otros",Danny Maaz,17 horas en total,69 ,Intermedio,"14,99 €","59,99 €"
"Google Sheets Intermedio: Domina la alternativa a Excel
Conoce y domina las hojas de cálculo de Google Sheets, con conocimientos previos básicos o avanzados de Microsoft Excel",Juan Carlos Guerrero Pérez,2 horas en total,20 ,Principiante,"14,99 €","24,99 €"
"Cómo crear reportes profesionales usando SAP Query
Aprenda a crear SAP Queries como todo un profesional, sin conocimientos de lenguaje Abap.","Cultura 52, Oriana Oviedo Ojeda, Jack Raifer Baruch","3,5 horas en total",25 ,Intermedio,"14,99 €","94,99 €"
"Excel Express
un café con Microsoft Excel.",GCap Consulting,"1,5 horas en total",34 ,Todos los niveles,"14,99 €","94,99 €"
"Microsoft Planner | Mejora la productividad en equipo
Planner de Microsoft 365 es una herramienta de organización de tareas",Alfonso Rinsche,"15,5 horas en total",183 ,Todos los niveles,"14,99 €","34,99 €"
"Power BI Desktop: Aprende ETL, Dax y Análisis de Datos
Aprende todo lo que necesitas saber para convertirte en un experto en Inteligencia de Negocios con Power BI (Act. 2020).",Alfonso Rinsche,"1,5 horas en total",31 ,Principiante,"14,99 €","94,99 €"
"Cómo introducir Kanban en tu equipo
Prácticas generales de Kanban",Etraining S.A DE C.V,7 horas en total,66 ,Todos los niveles,"14,99 €","49,99 €"
"Domina Microsoft Word 2019: De cero a experto
Domina el procesador de textos más conocido del mundo: Microsoft Word. Veremos Word 2019 en Microsoft Office 365",Ricardo Naya,5 horas en total,99 ,Todos los niveles,"14,99 €","94,99 €"
"De 0 a Experto en Pipedrive
Aprendiendo a utilizar Pipedrive como un profesional",Ricardo Naya,4 horas en total,23 ,Principiante,"14,99 €","89,99 €"
"Microsoft Excel - Curso nivel básico (1/2)
Aprende a crear una base de datos en Excel, aprendiendo los conceptos paso a paso","Sebastian Tunnell, Layla Scheli",6 horas en total,54 ,Todos los niveles,"14,99 €","94,99 €"
"PROGRAMAR EN AUTOCAD CON ""AUTOLISP"" - RECURSOS DESCARGABLES
Mejora tu productividad, ahorra tiempo","Raúl Montesinos, Numpi Cursos","2,5 horas en total",38 ,Intermedio,"14,99 €","19,99 €"
"Aprende Google Sheets (porque es mejor que Excel)
Todo lo que necesitas saber sobre esta increíble herramienta de trabajo",Jorge Leonardo Jesús Perroud,"3,5 horas en total",37 ,Todos los niveles,"14,99 €","59,99 €"
"Curso de Google Meet 2023, ¡Desde Cero Hasta Experto!
Aprende a cómo realizar videoconferencias, dictar clases, hacer chats e impartir webinars de forma fácil y simple.",Liliana Romero Llano,"2,5 horas en total",19 ,Principiante,"14,99 €","34,99 €"
"Microsoft Teams - Simplifique la colaboración
Microsoft Teams es una plataforma intuitiva que simplifica la colaboración dentro de las empresas.",Enrique Cena,"3,5 horas en total",55 ,Todos los niveles,"17,99 €","109,99 €"
"Tablas Dinámicas en Excel - Dashboards y Análisis de Datos
Domina las Pivot Tables y crea sofisticados Tableros ¡Sin fórmulas y con la herramienta más poderosa de Microsoft Excel!",Mundo Online Capacitación,2 horas en total,23 ,Todos los niveles,"14,99 €","19,99 €"
"Curso Excel Básico para principiantes
Curso Excel básico para principiantes. Aprende todo lo esencial de Excel sin rodeos, directo a lo que de verdad importa.",Federico Macías Vidal,"2,5 horas en total",21 ,Intermedio,"14,99 €","19,99 €"
"MAXIMIZA TU PRODUCTIVIDAD CON MI MÉTODO MONKEY AWAY
El Método infalible para incrementar la productividad y dejar de procrastinar",Vanina Berón,3 horas en total,37 ,Todos los niveles,"14,99 €","44,99 €"
"Tablas Dinámicas: Análisis de datos con Microsoft Excel
Aprende Tablas Dinámicas y transforma bases de datos en Dashboards impresionantes",Jose Javier Rivero,16 horas en total,80 ,Todos los niveles,"14,99 €","19,99 €"
"PLANIFICACION Y CONTROL DE PROYECTOS CON MS PROJECT Y EXCEL
Maneja las herramientas informáticas más utilizadas actualmente en la gestión de todo tipo de proyectos con enfoque PMI",David Julinho Caparachin Ricapa,4 horas en total,13 ,Todos los niveles,"14,99 €","44,99 €"
"Productividad de FÓRMULA 1 para equipos físicos y virtuales
5 claves críticas de gestión y productividad de equipos. Libera un 30% de tu tiempo para que tu empresa crezca de verdad",Cesar Herreros,7 horas en total,95 ,Principiante,"14,99 €","19,99 €"
"Microsoft Access TOTAL - El Entrenamiento Definitivo [2023]
Gestiona Bases de Datos con Microsoft Access como un campeón, ya sea usando solo Access o junto con Excel",Francisco Boira,"3,5 horas en total",63 ,Intermedio,"14,99 €","19,99 €"
"Aprende Excel básico e intermedio
Es un curso hecho a la medida, con todo lo que necesitas.",Jahaziel Guzmán Jiménez,1 hora en total,24 ,Todos los niveles,"14,99 €","54,99 €"
"Microsoft Excel: Análisis de datos con tablas dinámicas
La herramienta más poderosa de Excel.","Álvaro García, Lucía Fernández, Formación Certificada, Cursos Online Arquitectura",4 horas en total,44 ,Todos los niveles,"14,99 €","19,99 €"
"Curso de Zoom 2023, ¡Desde Cero Hasta Experto!
Aprende a cómo realizar videoconferencias, dictar clases, hacer chats e impartir webinars de forma fácil y simple.",Stefano Grimaldi Matos,"6,5 horas en total",59 ,Todos los niveles,"14,99 €","44,99 €"
"POWER BI (A-Z): Crea Impactantes DASHBOARDS Interactivos
Aprende POWER BI Paso a Paso y de manera Practica. Transforma Datos en Reportes y Análisis Profesionales.",Daniel Lledó Martínez,"1,5 horas en total",30 ,Todos los niveles,"14,99 €","94,99 €"
"Uso Profesional de tus archivos en la Nube con Google Drive
Ya nunca más pierdas información importante!, gestiona de forma profesional todos tus archivos almacenados en la nube.",Alfonso Rinsche,"1,5 horas en total",9 ,Principiante,"14,99 €","34,99 €"
"Zoom: Curso Rápido de Zoom | Video conferencias con Zoom
Videoconferencias y conferencias en Zoom - Tips, trucos y más de Zoom- Zoom para trabajar a distancia o desde casa",Alfonso Rinsche,4 horas en total,60 ,Todos los niveles,"14,99 €","94,99 €"
